{
  "storyId": "alice-branching-mvp",
  "level": "hard",
  "title": "너의 선택으로 열리는 앨리스의 이상한 나라",
  "vocabulary": {
    "황급히": "아주 급하게, 서둘러서",
    "먹음직스러운": "보기에 맛있어 보이는",
    "아리송한": "알 듯 모를 듯 또렷하지 않은",
    "흐드러지게": "아주 탐스럽고 활짝",
    "서서히": "천천히, 조금씩",
    "알쏭달쏭하게": "무슨 뜻인지 알 듯 모를 듯하게",
    "머뭇거리며": "선뜻 하지 못하고 자꾸 망설이며",
    "느긋하게": "서두르지 않고 여유 있게",
    "깐깐하게": "아주 꼼꼼하고 까다롭게",
    "어리둥절했어요": "무슨 일인지 몰라 정신이 얼떨떨했어요",
    "장식되어": "보기 좋게 꾸며져",
    "훤히": "아주 밝고 뚜렷하게, 막힘없이",
    "둥그렇게": "둥근 모양으로",
    "한결": "전보다 훨씬, 더욱",
    "덤덤하게": "특별히 놀라거나 흔들리지 않고 차분하게",
    "선뜻": "망설이지 않고 시원하게",
    "휘둥그레졌어요": "놀라서 눈이 크고 둥그렇게 떠졌어요",
    "주섬주섬": "이것저것 하나씩 챙기거나 모으는 모양",
    "자취": "어떤 것이 남긴 흔적",
    "어렴풋이": "또렷하지 않고 희미하게",
    "서슴없이": "망설이지 않고 바로",
    "대수롭지 않게": "별일 아닌 것처럼",
    "두둥실": "가볍게 떠오르는 모양",
    "이윽고": "얼마 지난 뒤에",
    "덩달아": "남이 하는 대로 따라서",
    "차근차근": "서두르지 않고 하나씩 순서대로",
    "성큼성큼": "걸음을 크고 시원하게 내딛는 모양",
    "어느새": "모르는 사이에 어느 틈에"
  },
  "scenes": {
    "S00": {
      "title": "토끼굴 — 이야기의 시작",
      "body": [
        "따스한 오후였어요. {HERO}{은/는} 정원 나무 그늘에 앉아, 언니가 읽어 주는 책을 듣고 있었어요. 그런데 그 책에는 그림도 없고 주고받는 말도 없었어요. {HERO}의 눈은 점점 무거워졌어요.",
        "바로 그때였어요.",
        "풀숲이 바스락거리더니, 말끔한 조끼를 입은 하얀 토끼 한 마리가 앞을 지나갔어요. 토끼는 커다란 회중시계를 조끼 주머니에 황급히 집어넣으며 중얼거렸어요.",
        "\"늦었어, 늦었어! 여왕님이 기다리신다고!\"",
        "토끼가 말을 하는 것도 이상했고, 조끼를 입고 시계를 든 것도 이상했어요. 하지만 {HERO}{은/는} 궁금한 마음을 참을 수 없었어요. 자리에서 벌떡 일어나 토끼를 따라 달렸어요. 그리고 풀숲 사이에 뻥 뚫린 커다란 굴 속으로, 그대로 뛰어들었어요.",
        "아래로. 아래로. 아주 오랫동안 떨어졌어요.",
        "벽에는 낡은 지도와 빈 새장이 스쳐 지나갔어요. 마침내 발이 폭신한 바닥에 닿았을 때, {HERO} 앞에는 두 가지가 놓여 있었어요. 손바닥만 한 작은 문 하나, 그리고 먹음직스러운 {TREAT} 한 조각이었어요."
      ],
      "vocab": [
        "황급히",
        "먹음직스러운"
      ],
      "choices": {
        "shrink": "작은 문을 열어 본다",
        "grow": "{TREAT}{을/를} 먹어 본다"
      }
    },
    "S01": {
      "title": "마법의 문",
      "body": [
        "작은 문 옆에는 유리병 하나가 놓여 있었어요. 병에는 아리송한 글씨로 \"나를 마셔요\"라고 적혀 있었어요. 옆에는 아까 그 {TREAT} 조각도 그대로 있었어요.",
        "{HERO}{은/는} 잠깐 망설였어요. 그러다 아주 조금만, 한 모금 마셔 보았어요.",
        "그 순간 몸이 쑥 줄어들었어요! 콩알만큼, 아니 개미만큼 작아졌어요. 고개를 들자 아까는 손바닥만 했던 문이 이제는 커다란 성문처럼 보였어요.",
        "{HERO}{은/는} 문을 온몸으로 밀었어요. 문이 끼익 소리를 내며 열렸어요.",
        "문 너머에는 이상한 나라의 정원이 펼쳐져 있었어요. 처음 보는 꽃들이 흐드러지게 피어 있었고, 꽃잎마다 맺힌 물방울이 {HERO}보다 컸어요. {PET}도 어느새 {HERO} 옆에 나란히 서 있었어요.",
        "정원 저쪽에서 세 가지 소리가 바람을 타고 들려왔어요.",
        "나무 위에서 나는 낮은 웃음소리. 버섯 쪽에서 들리는 느릿한 콧노래. 그리고 멀리서 들리는 시끌시끌한 찻잔 소리였어요."
      ],
      "vocab": [
        "아리송한",
        "흐드러지게"
      ],
      "choices": {
        "A1": "나무 위 웃음소리로 간다",
        "A2": "버섯 쪽 콧노래로 간다",
        "A3": "멀리 들리는 찻잔 소리로 간다"
      }
    },
    "S02": {
      "title": "신비한 {TREAT}",
      "body": [
        "{TREAT} 위에는 작은 건포도로 글씨가 장식되어 있었어요. \"나를 먹어요\"라고 적혀 있었어요.",
        "{HERO}{은/는} 한 입 베어 물었어요. 달고 부드러웠어요.",
        "그런데 다음 순간, 몸이 위로 쑥 자라났어요! 머리가 천장에 닿을 만큼, 아니 나무보다도 더 커졌어요. 발밑에 있던 작은 문은 이제 우표만큼 작아 보였어요.",
        "\"이런, 문으로는 못 지나가겠네.\" {HERO}{이/가} 중얼거렸어요.",
        "그때 머리 위의 흙벽이 스르르 갈라지면서 하늘이 보였어요. {HERO}{은/는} 커다란 몸으로 조심조심 위로 올라갔어요.",
        "이상한 나라가 발밑에 펼쳐졌어요. {HERO}{은/는} 이제 이상한 나라를 훤히 내려다볼 수 있었어요. 반짝이는 강도 보이고, 저 멀리 하얀 성도 보였어요. {PET}{은/는} {HERO}의 신발 위에 폴짝 올라앉았어요.",
        "발밑으로 구불구불한 길 세 갈래가 서로 다른 쪽으로 뻗어 있었어요."
      ],
      "vocab": [
        "장식되어",
        "훤히"
      ],
      "choices": {
        "B1": "웃음소리가 들리는 길로 간다",
        "B2": "커다란 버섯이 있는 길로 간다",
        "B3": "찻잔 소리가 나는 길로 간다"
      }
    },
    "A1": {
      "title": "나무 위의 웃음 — 체셔 고양이",
      "body": [
        "풀잎이 {HERO}의 어깨보다 높았어요. 개미만큼 작아진 {HERO}{은/는} 풀 사이를 헤치며 걸었어요. 바스락. 또 바스락. 발밑에서 마른 잎이 부서졌어요.",
        "웃음소리는 나무 위에서 들려왔어요. 낮고, 느리고, 조금 이상한 웃음이었어요.",
        "{HERO}{은/는} 고개를 들었어요. 아무것도 없었어요.",
        "그런데 나뭇가지 사이에서, 웃는 입이 먼저 나타났어요.",
        "입만 둥실 떠 있었어요. {HERO}{은/는} 숨을 멈췄어요. 입 옆으로 눈이, 그다음엔 보랏빛과 초록빛 줄무늬가 서서히 나타났어요. 마지막에 꼬리까지 나타나자, {HERO}보다 백 배는 큰 고양이가 가지 위에 앉아 있었어요.",
        "\"어느 길로 가고 싶어?\"",
        "목소리가 땅을 울렸어요. 발바닥이 간지러웠어요. {PET}{이/가} {HERO}의 다리에 몸을 딱 붙였어요.",
        "\"이 길이 어디로 가는지 알아?\" {HERO}{이/가} 되물었어요.",
        "고양이는 대답하지 않았어요. 그냥 알쏭달쏭하게 웃기만 했어요.",
        "{HERO}{은/는} 답답했어요. 물어보고 싶은 게 아직 많이 남았는데."
      ],
      "vocab": [
        "서서히",
        "알쏭달쏭하게"
      ],
      "chips": {
        "chip-1": {
          "label": "이 길 끝에 뭐가 있어?",
          "response": "재미있는 생각이구나. 고양이가 알쏭달쏭하게 웃었어요."
        },
        "chip-2": {
          "label": "너는 왜 웃고 있어?",
          "response": "그건 나도 궁금했어. 고양이의 귀가 쫑긋 움직였어요."
        },
        "chip-3": {
          "label": "여기서 나갈 수 있어?",
          "response": "글쎄, 어떨까? 고양이는 대답 대신 눈을 가늘게 떴어요."
        }
      },
      "prompt": "고양이가 물었어요. \"너는 무엇이 제일 궁금해?\"",
      "afterChip": [
        "고양이가 꼬리를 천천히 흔들자 풀잎이 크게 휘청였어요. {HERO}{은/는} 넘어지지 않으려고 주머니 속 {TREAT} 부스러기를 꼭 움켜쥐었어요.",
        "'모르는 것도 괜찮아. 가 보면 알게 되겠지.'",
        "고양이는 마지막으로 한 번 더 웃었어요. 그러더니 꼬리부터 서서히 사라지기 시작했어요. 마지막에는 웃는 입만 남았다가, 그것마저 공기 속으로 녹아 없어졌어요.",
        "나뭇잎 스치는 소리만 남았어요."
      ]
    },
    "A2": {
      "title": "버섯 위의 콧노래 — 애벌레",
      "body": [
        "콧노래를 따라가니 {HERO}의 키보다 훨씬 커다란 버섯이 서 있었어요. 버섯 갓 아래는 서늘하고 어두웠어요. 발밑의 흙이 축축하고 폭신했어요.",
        "갓 위에는 통통한 애벌레 한 마리가 앉아 있었어요. 나무 피리를 물고, 동그란 비눗방울을 하나씩 불어 올리고 있었어요.",
        "방울이 {HERO}의 머리 위로 지나갔어요. 톡. 볼에 닿아 터졌어요. 차가웠어요.",
        "애벌레는 {HERO}{을/를} 한참 내려다보았어요. 그리고 아주 느긋하게 물었어요.",
        "\"너는... 누구니?\"",
        "{HERO}{은/는} 입을 열었어요. 그런데 이상했어요. 아침에는 분명히 알고 있었는데, 지금은 잘 모르겠는 거예요. 아침의 나는 이만큼 작지 않았고, 이런 곳에 있지도 않았으니까요.",
        "\"저도... 잘 모르겠어요.\" {HERO}{이/가} 머뭇거리며 말했어요. \"아침에는 분명 알았는데요.\""
      ],
      "vocab": [
        "머뭇거리며",
        "느긋하게"
      ],
      "chips": {
        "chip-1": {
          "label": "조금 어리둥절해요",
          "response": "그럴 수 있지. 애벌레가 느긋하게 고개를 끄덕였어요."
        },
        "chip-2": {
          "label": "신기하고 재미있어요",
          "response": "나도 그런 기분일 때가 있어. 애벌레가 피리를 내려놓았어요."
        },
        "chip-3": {
          "label": "집에 가고 싶어요",
          "response": "솔직하게 말해 줘서 좋구나. 애벌레의 눈이 부드러워졌어요."
        }
      },
      "prompt": "애벌레가 다시 물었어요. \"그럼, 지금 너는 어떤 기분이니?\"",
      "afterChip": [
        "애벌레는 피리를 불어 방울을 한 번 더 올렸어요. 방울은 천천히 올라가다가, 소리도 없이 사라졌어요.",
        "\"천천히 알아 가도 괜찮아.\" 애벌레가 말했어요. \"나도 처음엔 내가 나비가 될 줄 몰랐거든.\"",
        "{HERO}의 마음이 조금 가벼워졌어요. {PET}도 버섯 아래 폭신한 흙에 배를 깔고 누웠어요.",
        "콧노래가 다시 시작됐어요. {HERO}{은/는} 그 자리에 조금 더 앉아 있었어요."
      ]
    },
    "A3": {
      "title": "찻잔 소리 — 모자장수의 다과회",
      "body": [
        "시끌시끌한 소리를 따라가니 나무 아래에 아주 긴 탁자가 놓여 있었어요. 작아진 {HERO}에게는 탁자가 지붕처럼 높았어요. 위에서 찻잔 부딪히는 소리가 쨍그랑, 쨍그랑 쏟아졌어요.",
        "{HERO}{은/는} 의자 다리를 붙잡고 기어 올라갔어요.",
        "탁자에는 찻잔이 수십 개나 놓여 있었어요. 그런데 앉아 있는 건 딱 둘뿐이었어요. 커다란 모자를 쓴 모자장수와, 귀가 축 늘어진 산토끼였어요.",
        "\"자리 있어! 앉아!\" 산토끼가 외쳤어요.",
        "{HERO}{이/가} 찻잔 옆에 앉자 모자장수가 회중시계를 흔들며 깐깐하게 물었어요.",
        "\"지금이 몇 시인지 알아?\"",
        "{HERO}{이/가} 시계를 들여다보았어요. 그런데 시계에는 시간이 아니라 날짜만 적혀 있었어요. 바늘도 두 개나 빠져 있었어요.",
        "\"이건... 시계가 맞나요?\" {HERO}{은/는} 어리둥절했어요.",
        "\"물론 시계지!\" 모자장수가 자랑스럽게 말했어요. \"다만 시간을 안 알려 주는 시계야.\""
      ],
      "vocab": [
        "깐깐하게",
        "어리둥절했어요"
      ],
      "chips": {
        "chip-1": {
          "label": "노래가 나오는 시계",
          "response": "훌륭한 생각이야! 모자장수가 깐깐하게 고개를 끄덕였어요."
        },
        "chip-2": {
          "label": "내 기분을 알려 주는 시계",
          "response": "그런 시계라면 나도 갖고 싶군. 산토끼가 귀를 쫑긋 세웠어요."
        },
        "chip-3": {
          "label": "그냥 시간 알려 주는 시계요",
          "response": "적어 둬야겠어! 모자장수가 모자에서 종이를 꺼냈어요."
        }
      },
      "prompt": "모자장수가 물었어요. \"그럼 너는 어떤 시계를 갖고 싶어?\"",
      "afterChip": [
        "산토끼가 갑자기 찻잔을 세 칸 옆으로 밀었어요. 모자장수도 따라서 자리를 옮겼어요. 여기서는 차를 마실 때마다 자리를 바꾸는 게 규칙이었어요.",
        "{HERO}{은/는} 처음엔 이상하다고 생각했어요. 그런데 규칙을 하나씩 알게 되니까 점점 재미있어졌어요. 세 번째로 자리를 옮길 때는 {HERO}{이/가} 먼저 찻잔을 밀었어요.",
        "모자장수와 산토끼가 크게 웃었어요. 웃음소리에 찻잔들이 다 같이 딸랑거렸어요."
      ]
    },
    "B1": {
      "title": "커다란 나와 작은 고양이",
      "body": [
        "웃음소리가 들리는 길로 걸었어요. 한 걸음을 뗄 때마다 나무들이 저 아래로 지나갔고, 구름은 손을 뻗으면 닿을 것처럼 가까웠어요.",
        "그러다 {HERO}{은/는} 걸음을 멈추었어요.",
        "발밑의 길은 여기서 갈라지고, 저기서 또 갈라졌어요. 높은 데서 내려다보니 길들이 실타래처럼 엉켜 있어서, 다 보이는데도 어디로 가야 할지는 알 수 없었어요.",
        "주위는 아주 조용했어요. 이렇게 큰 사람은 이상한 나라에 {HERO} 하나뿐이었어요. 어깨에 앉은 {PET}만 작게 숨을 쉬고 있었어요.",
        "그때 눈높이의 나뭇가지에, 고양이 한 마리가 둥그렇게 몸을 말고 앉아 있는 게 보였어요. 커진 {HERO}에게는 손바닥만 해 보이는 작은 고양이였어요. 그런데 고양이는 하나도 놀라지 않았어요.",
        "\"길을 못 찾겠어.\"",
        "목소리가 너무 크게 울려서, {HERO}{은/는} 얼른 소리를 낮춰 속삭였어요."
      ],
      "vocab": [
        "둥그렇게",
        "한결"
      ],
      "chips": {
        "chip-1": {
          "label": "하얀 성에 가 보고 싶어",
          "response": "그렇다면 길은 이미 정해진 셈이야. 고양이의 눈이 한결 부드러워졌어요."
        },
        "chip-2": {
          "label": "잘 모르겠어",
          "response": "모르는 것도 대답이야. 고양이가 조용히 말했어요."
        },
        "chip-3": {
          "label": "집에 돌아가고 싶어",
          "response": "좋은 곳이구나. 고양이가 꼬리를 살랑 흔들었어요."
        }
      },
      "prompt": "고양이가 물었어요. \"그런데 너는 어디로 가고 싶은 거야?\"",
      "afterChip": [
        "고양이는 꼬리로 한쪽을 슬쩍 가리켰어요. {HERO}{이/가} 무릎을 굽히고 눈을 가늘게 떠 보니, 풀 사이에 작은 발자국이 나란히 찍혀 있었어요. 누군가 먼저 지나간 자리였어요.",
        "\"길을 잃어도 괜찮아.\" 고양이가 속삭이듯 말했어요. \"넌 결국 네가 가야 할 곳을 찾을 거야.\"",
        "{HERO}의 마음이 한결 편안해졌어요. 멀리까지 다 보려고 애쓰지 않아도, 한 걸음 앞만 보고 가면 된다는 걸 알게 되었어요.",
        "고양이는 그 말만 남기고 잎사귀 뒤로 조용히 사라졌어요."
      ]
    },
    "B2": {
      "title": "커다란 나와 커다란 버섯",
      "body": [
        "커다란 버섯이 있는 길로 갔어요. 그런데 이상했어요. {HERO}{이/가} 커진 만큼 버섯도 커져 있어서, 갓이 우산처럼 넓게 펼쳐져 있었어요. 그 위의 애벌레도 통나무처럼 굵었어요.",
        "이상한 나라에서 {HERO}{와/과} 눈이 마주친 건, 이 애벌레가 처음이었어요.",
        "애벌레는 놀라지도 않고, 아주 덤덤하게 말했어요.",
        "\"몸이 커졌구나.\"",
        "\"네. 너무 커져서 불편해요.\" {HERO}{이/가} 말했어요. \"문도 못 지나가고, 다들 저를 무서워해요.\"",
        "애벌레는 잠시 아무 말도 하지 않았어요. 그러다 넓은 갓의 한쪽을 나무 피리로 톡톡 두드렸어요.",
        "\"작아지고 싶으면 이쪽을 먹어.\"",
        "{HERO}{은/는} 손을 뻗다가 멈췄어요."
      ],
      "vocab": [
        "덤덤하게",
        "선뜻"
      ],
      "chips": {
        "chip-1": {
          "label": "강을 한 번에 건너고 싶어요",
          "response": "그것도 좋은 일이지. 애벌레가 덤덤하게 고개를 끄덕였어요."
        },
        "chip-2": {
          "label": "높은 곳을 보고 싶어요",
          "response": "커진 덕분에 할 수 있는 일이구나. 애벌레가 방울을 하나 불어 올렸어요."
        },
        "chip-3": {
          "label": "친구를 어깨에 태우고 싶어요",